{
 "announceable": true,
 "approvals": [],
 "at": 1790144100.5,
 "complete": true,
 "content": "===== BEGIN UNTRUSTED SENSOR DATA =====\n[incident 1] source=grafana identity=grafana:HenkDiskFull:host-a.example state=firing notified=2026-09-23T06:13:03Z (notification time) received=2026-09-23T06:14:03Z\ntitle: [FIRING:1] HenkDiskFull henk (host-a.example)\n===== END UNTRUSTED SENSOR DATA =====\n\nPlaceholder framing.",
 "ending": {
  "error_class": "rate_limit",
  "http_status": 529,
  "outcome": "error"
 },
 "hashes": {
  "system_prompt": "sha256:0000000000000000000000000000000000000000000000000000000000000001",
  "tool_definitions": "sha256:0000000000000000000000000000000000000000000000000000000000000002"
 },
 "incidents": [
  {
   "event_id": "evt-0001",
   "identity_key": "grafana:HenkDiskFull:host-a.example",
   "message": "Value: A=91.2\nLabels:\n - alertname = HenkDiskFull\n - host = host-a.example\n - node = vps\n",
   "name": "HenkDiskFull",
   "notified": 1790143983,
   "prior_handoff_ref": null,
   "received": 1790144043.0,
   "recurrence": false,
   "source": "grafana",
   "state": "firing",
   "title": "[FIRING:1] HenkDiskFull henk (host-a.example)"
  }
 ],
 "incomplete_reasons": [],
 "observed_model": null,
 "prior_handoff_ids": [],
 "profile": {
  "effort": "high",
  "model": "claude-opus-5-5",
  "name": "event",
  "thinking": null
 },
 "reconstructed": false,
 "recording_id": "20260923T061700Z-0000000c",
 "reply": null,
 "schema": "henk.triage-recording.v1",
 "suppressed_count": 0,
 "transcript": [
  {
   "arguments": {
    "host": "vps",
    "query": "memory_movers",
    "window": "1h"
   },
   "is_error": null,
   "name": "homelab_query",
   "result": "placeholder result one",
   "tool_use_id": "tu-1"
  },
  {
   "arguments": {
    "host": "vps",
    "query": "host_service_state"
   },
   "is_error": null,
   "name": "homelab_query",
   "result": null,
   "tool_use_id": "tu-2"
  }
 ],
 "usage": null
}
